<?xml version="1.0" ?>

<template xmlns="http://schemas.sulu.io/template/template"
          xmlns:xsi="http://www.w3.org/2001/XMLSchema-instance"
          xsi:schemaLocation="http://schemas.sulu.io/template/template http://schemas.sulu.io/template/template-1.0.xsd">

    <key>complex</key>

    <view>ClientWebsiteBundle:Website:complex.html.twig</view>
    <controller>SuluWebsiteBundle:Default:index</controller>
    <cacheLifetime>4800</cacheLifetime>

    <properties>
        <property name="title" type="text_line" mandatory="true"/>
        <property name="url" type="resource_locator" mandatory="true"/>
        <property name="article" type="text_editor" mandatory="true"/>
        <block name="block1" minOccurs="2" maxOccurs="10" mandatory="true">
            <properties>
                <property name="title1.1" type="text_line" mandatory="true"/>
                <property name="article1.1" type="text_area" mandatory="true" minOccurs="2"/>
                <block name="block1.1">
                    <properties>
                        <block name="block1.1.1">
                            <properties>
                                <property name="article1.1.1" type="text_area" mandatory="true" minOccurs="2"/>
                                <property name="article2.1.2" type="text_area" mandatory="true" minOccurs="2"/>
                                <block name="block1.1.3">
                                    <properties>
                                        <property name="article1.1.3.1" type="text_area" mandatory="true"
                                                  minOccurs="2"/>
                                    </properties>
                                </block>
                            </properties>
                        </block>
                        <block name="block1.1.2">
                            <properties>
                                <property name="article1.1.2.1" type="text_area" mandatory="true" minOccurs="2"/>
                            </properties>
                        </block>
                    </properties>
                </block>
            </properties>
        </block>
        <property name="blog" type="text_editor" mandatory="true"/>
    </properties>
</template>
